{
  "$schema": "https://zarguell.github.io/eoltracker/v1/schema/hardware.json",
  "id": "extreme-wap912319-e6",
  "name": "WAP912319-E6",
  "category": "hardware",
  "vendor": "Extreme Networks",
  "product_line": "Extreme Networks",
  "family": "Extreme Networks",
  "model_number": "WAP912319-E6",
  "milestones": {
    "ga": null,
    "eos": "2016-12-10",
    "eossec": null,
    "eol": "2022-12-10"
  },
  "status": "eol",
  "upstream": {
    "Marketing Part Number": {
      "text": "WAP912319-E6",
      "value": null,
      "datetime": null,
      "role": null,
      "links": []
    },
    "Product Name": {
      "text": "WAP912319-E6",
      "value": null,
      "datetime": null,
      "role": null,
      "links": []
    },
    "Product Short Description": {
      "text": "WAP 9123 abgn 3X3 R19 INDONESIA",
      "value": null,
      "datetime": null,
      "role": null,
      "links": []
    },
    "EOS date": {
      "text": "42714",
      "value": null,
      "datetime": null,
      "role": null,
      "links": [],
      "raw": "42714"
    },
    "EOSL date": {
      "text": "44905",
      "value": null,
      "datetime": null,
      "role": null,
      "links": [],
      "raw": "44905"
    },
    "End of Software Maintenance": {
      "text": "",
      "value": null,
      "datetime": null,
      "role": null,
      "links": [],
      "note": "the date firmware and applications stop receiving maintenance releases. This is a maintenance window, not a stated security-support end, so it is published and never mapped to eossec; the vendor's five-year support statement is not applied to it either."
    },
    "Run date": {
      "text": "December 16, 2025",
      "value": null,
      "datetime": null,
      "role": null,
      "links": [],
      "note": "the date the vendor stamped on the sheet this row was read from; it is the only version signal the extract carries."
    }
  },
  "provenance": {
    "source_urls": [
      "https://www.extremenetworks.com/support/end-of-sale-and-end-of-support-products/",
      "https://www.extremenetworks.com/support/end-of-sale-and-end-of-support-products/"
    ],
    "verifier": "deterministic-extreme",
    "last_checked": "2026-09-26T20:36:39Z"
  }
}
