{
  "$schema": "https://zarguell.github.io/eoltracker/v1/schema/hardware.json",
  "id": "juniper-networks-cbl2-ptx-sp-us-n",
  "name": "CBL2-PTX-SP-US-N",
  "category": "hardware",
  "vendor": "Juniper Networks",
  "product_line": "Juniper Networks PTX Series",
  "family": "PTX Series",
  "model_number": "CBL2-PTX-SP-US-N",
  "milestones": {
    "ga": null,
    "eos": null,
    "eossec": null,
    "eol": "2029-04-03"
  },
  "status": "supported",
  "upstream": {
    "Product": {
      "text": "CBL2-PTX-SP-US-N",
      "datetime": null,
      "value": null,
      "role": "product",
      "links": []
    },
    "Model Number": {
      "text": "CBL2-PTX-SP-US-N",
      "datetime": null,
      "value": null,
      "role": "model",
      "links": []
    },
    "Product Line": {
      "text": "Juniper Networks PTX Series",
      "datetime": null,
      "value": null,
      "role": "line",
      "links": []
    },
    "EOL Announced": {
      "text": "2022-06-13",
      "datetime": null,
      "value": "2022-06-13",
      "role": null,
      "links": []
    },
    "End of Support": {
      "text": "2029-04-03",
      "datetime": null,
      "value": "2029-04-03",
      "role": "eol",
      "links": []
    },
    "Last Date to Convert Warranty": {
      "text": "Apr. 03, 2024",
      "datetime": "2024-04-03",
      "value": "2024-04-03",
      "role": null,
      "links": []
    },
    "Next Day Support Discontinued": {
      "text": "2028-04-03",
      "datetime": null,
      "value": "2028-04-03",
      "role": null,
      "links": []
    },
    "Same Day Support Discontinued": {
      "text": "2028-04-03",
      "datetime": null,
      "value": "2028-04-03",
      "role": null,
      "links": []
    }
  },
  "provenance": {
    "source_urls": [
      "https://eosl.date/network/routers/vendor/juniper-networks/ptx-series/"
    ],
    "verifier": "deterministic-eosl-date",
    "last_checked": "2026-09-17T12:53:12Z"
  }
}
