{
  "$schema": "https://zarguell.github.io/eoltracker/v1/schema/hardware.json",
  "id": "extreme-30707",
  "name": "30707",
  "category": "hardware",
  "vendor": "Extreme Networks",
  "product_line": "Extreme Networks",
  "family": "Extreme Networks",
  "model_number": "30707",
  "milestones": {
    "ga": null,
    "eos": "2024-12-15",
    "eossec": null,
    "eol": "2029-12-15"
  },
  "status": "expiring",
  "upstream": {
    "Marketing Part Number": {
      "text": "30707",
      "value": null,
      "datetime": null,
      "role": null,
      "links": []
    },
    "Product Name": {
      "text": "30707",
      "value": null,
      "datetime": null,
      "role": null,
      "links": []
    },
    "Product Short Description": {
      "text": "WS-AI-DE10055 10/6DBI 55DEG SECTOR",
      "value": null,
      "datetime": null,
      "role": null,
      "links": []
    },
    "EOS date": {
      "text": "45641",
      "value": null,
      "datetime": null,
      "role": null,
      "links": [],
      "raw": "45641"
    },
    "EOSM date": {
      "text": "44592",
      "value": null,
      "datetime": null,
      "role": null,
      "links": [],
      "raw": "44592"
    },
    "EOSL date": {
      "text": "47467",
      "value": null,
      "datetime": null,
      "role": null,
      "links": [],
      "raw": "47467"
    },
    "End of Software Maintenance": {
      "text": "2022-01-31",
      "value": null,
      "datetime": null,
      "role": null,
      "links": [],
      "note": "the date firmware and applications stop receiving maintenance releases. This is a maintenance window, not a stated security-support end, so it is published and never mapped to eossec; the vendor's five-year support statement is not applied to it either."
    },
    "Run date": {
      "text": "December 16, 2025",
      "value": null,
      "datetime": null,
      "role": null,
      "links": [],
      "note": "the date the vendor stamped on the sheet this row was read from; it is the only version signal the extract carries."
    }
  },
  "provenance": {
    "source_urls": [
      "https://www.extremenetworks.com/support/end-of-sale-and-end-of-support-products/",
      "https://www.extremenetworks.com/support/end-of-sale-and-end-of-support-products/"
    ],
    "verifier": "deterministic-extreme",
    "last_checked": "2026-09-26T20:36:39Z"
  }
}
