{
  "$schema": "https://zarguell.github.io/eoltracker/v1/schema/hardware.json",
  "id": "checkpoint-vsx-appliances-vsx-1-11075",
  "name": "VSX-1 11075",
  "category": "hardware",
  "vendor": "Check Point",
  "product_line": "Check Point",
  "family": "VSX Appliances",
  "model_number": "VSX-1 11075",
  "milestones": {
    "ga": null,
    "eos": null,
    "eossec": null,
    "eol": "2017-04-01"
  },
  "status": "eol",
  "upstream": {
    "Appliance Product/Model": {
      "text": "VSX-1 11075",
      "value": null,
      "datetime": null,
      "role": null,
      "links": []
    },
    "Status": {
      "text": "Successor Product Available",
      "value": null,
      "datetime": null,
      "role": null,
      "links": []
    },
    "General Availability": {
      "text": "Jun-2010",
      "value": null,
      "datetime": null,
      "role": null,
      "links": []
    },
    "End of Sale": {
      "text": "N/A",
      "value": null,
      "datetime": null,
      "role": null,
      "links": []
    },
    "Successor Model": {
      "text": "21400 VSX Appliance",
      "value": null,
      "datetime": null,
      "role": null,
      "links": []
    },
    "Successor Product Availability": {
      "text": "1-Apr-2012",
      "value": null,
      "datetime": null,
      "role": null,
      "links": []
    },
    "End of Engineering Support": {
      "text": "1-Apr-2015",
      "value": null,
      "datetime": null,
      "role": null,
      "links": [],
      "note": "Check Point defines this as maintenance releases until three years after end of sale, which is not a security-support end; the cell is published and never mapped to eossec"
    },
    "End of Support": {
      "text": "1-Apr-2017",
      "value": null,
      "datetime": null,
      "role": null,
      "links": []
    },
    "Supported Software Versions": {
      "text": "R77, R76, R75.40VS, NGX R68, NGX R67 VSX",
      "value": null,
      "datetime": null,
      "role": null,
      "links": []
    },
    "not_published": {
      "text": "General Availability: the cell states '2010-06' at month precision, and the hardware schema holds a calendar day; the vendor's own month is kept in this row's cells and is not padded into a day",
      "value": null,
      "datetime": null,
      "role": null,
      "links": []
    }
  },
  "provenance": {
    "source_urls": [
      "https://www.checkpoint.com/support-services/support-life-cycle-policy/"
    ],
    "verifier": "deterministic-checkpoint-appliances",
    "last_checked": "2026-09-26T18:53:27Z"
  }
}
