{
  "$schema": "https://zarguell.github.io/eoltracker/v1/schema/hardware.json",
  "id": "extreme-ah-a3-10k-sl-5-r",
  "name": "AH-A3-10K-SL-5-R",
  "category": "hardware",
  "vendor": "Extreme Networks",
  "product_line": "Extreme Networks",
  "family": "Extreme Networks",
  "model_number": "AH-A3-10K-SL-5-R",
  "milestones": {
    "ga": null,
    "eos": "2020-04-06",
    "eossec": null,
    "eol": "2023-06-30"
  },
  "status": "eol",
  "upstream": {
    "Marketing Part Number": {
      "text": "AH-A3-10K-SL-5-R",
      "value": null,
      "datetime": null,
      "role": null,
      "links": []
    },
    "Product Name": {
      "text": "AH-A3-10K-SL-5-R",
      "value": null,
      "datetime": null,
      "role": null,
      "links": []
    },
    "Product Short Description": {
      "text": "AH-A3-10K-SL-5-R",
      "value": null,
      "datetime": null,
      "role": null,
      "links": []
    },
    "EOS date": {
      "text": "43927",
      "value": null,
      "datetime": null,
      "role": null,
      "links": [],
      "raw": "43927"
    },
    "EOSL date": {
      "text": "45107",
      "value": null,
      "datetime": null,
      "role": null,
      "links": [],
      "raw": "45107"
    },
    "End of Software Maintenance": {
      "text": "",
      "value": null,
      "datetime": null,
      "role": null,
      "links": [],
      "note": "the date firmware and applications stop receiving maintenance releases. This is a maintenance window, not a stated security-support end, so it is published and never mapped to eossec; the vendor's five-year support statement is not applied to it either."
    },
    "Run date": {
      "text": "December 16, 2025",
      "value": null,
      "datetime": null,
      "role": null,
      "links": [],
      "note": "the date the vendor stamped on the sheet this row was read from; it is the only version signal the extract carries."
    }
  },
  "provenance": {
    "source_urls": [
      "https://www.extremenetworks.com/support/end-of-sale-and-end-of-support-products/",
      "https://extr-p-001.sitecorecontenthub.cloud/api/public/content/7625ff270f974e338948ad890b5f9ec4?v=6d523767",
      "https://extr-p-001.sitecorecontenthub.cloud/api/public/content/0617d83b2519466f83534df56bc3c9c1?v=bc6e33f0"
    ],
    "verifier": "deterministic-extreme",
    "last_checked": "2026-09-26T20:55:29Z"
  }
}
