{
  "$schema": "https://zarguell.github.io/eoltracker/v1/schema/hardware.json",
  "id": "juniper-networks-cpp-100g",
  "name": "CPP-100G",
  "category": "hardware",
  "vendor": "Juniper Networks",
  "product_line": "Juniper Networks Junos Space Connectivity Servic",
  "family": "Junos Space Connectivity Service",
  "model_number": "CPP-100G",
  "milestones": {
    "ga": null,
    "eos": null,
    "eossec": null,
    "eol": "2023-06-14"
  },
  "status": "eol",
  "upstream": {
    "Product": {
      "text": "CPP-100G",
      "datetime": null,
      "value": null,
      "role": "product",
      "links": []
    },
    "Model Number": {
      "text": "CPP-100G",
      "datetime": null,
      "value": null,
      "role": "model",
      "links": []
    },
    "Product Line": {
      "text": "Juniper Networks Junos Space Connectivity Servic",
      "datetime": null,
      "value": null,
      "role": "line",
      "links": []
    },
    "EOL Announced": {
      "text": "2022-11-15",
      "datetime": null,
      "value": "2022-11-15",
      "role": null,
      "links": []
    },
    "End of Support": {
      "text": "2023-06-14",
      "datetime": null,
      "value": "2023-06-14",
      "role": "eol",
      "links": []
    },
    "Last Date to Convert Warranty": {
      "text": "Nov. 15, 2023",
      "datetime": "2023-11-15",
      "value": "2023-11-15",
      "role": null,
      "links": []
    },
    "Next Day Support Discontinued": {
      "text": "2023-06-14",
      "datetime": null,
      "value": "2023-06-14",
      "role": null,
      "links": []
    },
    "Same Day Support Discontinued": {
      "text": "2023-06-14",
      "datetime": null,
      "value": "2023-06-14",
      "role": null,
      "links": []
    }
  },
  "provenance": {
    "source_urls": [
      "https://eosl.date/network/network-management-software/vendor/juniper-networks/junos-space-connectivity-service/"
    ],
    "verifier": "deterministic-eosl-date",
    "last_checked": "2026-09-17T12:53:12Z"
  }
}
