{
  "$schema": "https://zarguell.github.io/eoltracker/v1/schema/hardware.json",
  "id": "juniper-networks-cbl-ptx-la-it",
  "name": "CBL-PTX-LA-IT",
  "category": "hardware",
  "vendor": "Juniper Networks",
  "product_line": "Juniper Networks PTX Series",
  "family": "PTX Series",
  "model_number": "CBL-PTX-LA-IT",
  "milestones": {
    "ga": null,
    "eos": null,
    "eossec": null,
    "eol": "2027-03-31"
  },
  "status": "supported",
  "upstream": {
    "Product": {
      "text": "CBL-PTX-LA-IT",
      "datetime": null,
      "value": null,
      "role": "product",
      "links": []
    },
    "Model Number": {
      "text": "CBL-PTX-LA-IT",
      "datetime": null,
      "value": null,
      "role": "model",
      "links": []
    },
    "Product Line": {
      "text": "Juniper Networks PTX Series",
      "datetime": null,
      "value": null,
      "role": "line",
      "links": []
    },
    "EOL Announced": {
      "text": "2021-03-25",
      "datetime": null,
      "value": "2021-03-25",
      "role": null,
      "links": []
    },
    "End of Support": {
      "text": "2027-03-31",
      "datetime": null,
      "value": "2027-03-31",
      "role": "eol",
      "links": []
    },
    "Last Date to Convert Warranty": {
      "text": "Mar. 31, 2023",
      "datetime": "2023-03-31",
      "value": "2023-03-31",
      "role": null,
      "links": []
    },
    "Next Day Support Discontinued": {
      "text": "2027-03-31",
      "datetime": null,
      "value": "2027-03-31",
      "role": null,
      "links": []
    },
    "Same Day Support Discontinued": {
      "text": "2027-03-31",
      "datetime": null,
      "value": "2027-03-31",
      "role": null,
      "links": []
    }
  },
  "provenance": {
    "source_urls": [
      "https://eosl.date/network/routers/vendor/juniper-networks/ptx-series/"
    ],
    "verifier": "deterministic-eosl-date",
    "last_checked": "2026-09-17T12:53:12Z"
  }
}
