{
  "$schema": "https://zarguell.github.io/eoltracker/v1/schema/hardware.json",
  "id": "extreme-xen-twx-0108",
  "name": "XEN-TWX-0108",
  "category": "hardware",
  "vendor": "Extreme Networks",
  "product_line": "Extreme Networks",
  "family": "Extreme Networks",
  "model_number": "XEN-TWX-0108",
  "milestones": {
    "ga": null,
    "eos": "2019-12-31",
    "eossec": null,
    "eol": "2024-12-31"
  },
  "status": "eol",
  "upstream": {
    "Marketing Part Number": {
      "text": "XEN-TWX-0108",
      "value": null,
      "datetime": null,
      "role": null,
      "links": []
    },
    "Product Name": {
      "text": "XEN-TWX-0108",
      "value": null,
      "datetime": null,
      "role": null,
      "links": []
    },
    "Product Short Description": {
      "text": "FRU, TWINAX,1 METER,8 PACK",
      "value": null,
      "datetime": null,
      "role": null,
      "links": []
    },
    "EOS date": {
      "text": "43830",
      "value": null,
      "datetime": null,
      "role": null,
      "links": [],
      "raw": "43830"
    },
    "EOSL date": {
      "text": "45657",
      "value": null,
      "datetime": null,
      "role": null,
      "links": [],
      "raw": "45657"
    },
    "End of Software Maintenance": {
      "text": "",
      "value": null,
      "datetime": null,
      "role": null,
      "links": [],
      "note": "the date firmware and applications stop receiving maintenance releases. This is a maintenance window, not a stated security-support end, so it is published and never mapped to eossec; the vendor's five-year support statement is not applied to it either."
    },
    "Run date": {
      "text": "December 16, 2025",
      "value": null,
      "datetime": null,
      "role": null,
      "links": [],
      "note": "the date the vendor stamped on the sheet this row was read from; it is the only version signal the extract carries."
    }
  },
  "provenance": {
    "source_urls": [
      "https://www.extremenetworks.com/support/end-of-sale-and-end-of-support-products/",
      "https://www.extremenetworks.com/support/end-of-sale-and-end-of-support-products/"
    ],
    "verifier": "deterministic-extreme",
    "last_checked": "2026-09-26T20:36:39Z"
  }
}
