{
  "$schema": "https://zarguell.github.io/eoltracker/v1/schema/hardware.json",
  "id": "juniper-networks-pdu-ptx-dc-120-r",
  "name": "PDU-PTX-DC-120-R",
  "category": "hardware",
  "vendor": "Juniper Networks",
  "product_line": "Juniper Networks PTX Series",
  "family": "PTX Series",
  "model_number": "PDU-PTX-DC-120-R",
  "milestones": {
    "ga": null,
    "eos": null,
    "eossec": null,
    "eol": "2024-10-04"
  },
  "status": "eol",
  "upstream": {
    "Product": {
      "text": "PDU-PTX-DC-120-R",
      "datetime": null,
      "value": null,
      "role": "product",
      "links": []
    },
    "Model Number": {
      "text": "PDU-PTX-DC-120-R",
      "datetime": null,
      "value": null,
      "role": "model",
      "links": []
    },
    "Product Line": {
      "text": "Juniper Networks PTX Series",
      "datetime": null,
      "value": null,
      "role": "line",
      "links": []
    },
    "EOL Announced": {
      "text": "2019-10-04",
      "datetime": null,
      "value": "2019-10-04",
      "role": null,
      "links": []
    },
    "End of Support": {
      "text": "2024-10-04",
      "datetime": null,
      "value": "2024-10-04",
      "role": "eol",
      "links": []
    },
    "Last Date to Convert Warranty": {
      "text": "Oct. 04, 2020",
      "datetime": "2020-10-04",
      "value": "2020-10-04",
      "role": null,
      "links": []
    },
    "Next Day Support Discontinued": {
      "text": "2024-10-04",
      "datetime": null,
      "value": "2024-10-04",
      "role": null,
      "links": []
    },
    "Same Day Support Discontinued": {
      "text": "2024-10-04",
      "datetime": null,
      "value": "2024-10-04",
      "role": null,
      "links": []
    }
  },
  "provenance": {
    "source_urls": [
      "https://eosl.date/network/routers/vendor/juniper-networks/ptx-series/"
    ],
    "verifier": "deterministic-eosl-date",
    "last_checked": "2026-09-17T12:53:12Z"
  }
}
