{
  "$schema": "https://zarguell.github.io/eoltracker/v1/schema/hardware.json",
  "id": "extreme-1g-sfp-sx-om-8",
  "name": "1G-SFP-SX-OM-8",
  "category": "hardware",
  "vendor": "Extreme Networks",
  "product_line": "Extreme Networks",
  "family": "Extreme Networks",
  "model_number": "1G-SFP-SX-OM-8",
  "milestones": {
    "ga": null,
    "eos": "2022-07-15",
    "eossec": null,
    "eol": null
  },
  "status": "unknown",
  "upstream": {
    "Marketing Part Number": {
      "text": "1G-SFP-SX-OM-8",
      "value": null,
      "datetime": null,
      "role": null,
      "links": []
    },
    "Product Name": {
      "text": "1G-SFP-SX-OM-8",
      "value": null,
      "datetime": null,
      "role": null,
      "links": []
    },
    "Product Short Description": {
      "text": "1000BASE-SX SFP OPTIC 8 PACK,MMF,LC CONN",
      "value": null,
      "datetime": null,
      "role": null,
      "links": []
    },
    "EOS date": {
      "text": "44757",
      "value": null,
      "datetime": null,
      "role": null,
      "links": [],
      "raw": "44757"
    },
    "EOSM date": {
      "text": "46752",
      "value": null,
      "datetime": null,
      "role": null,
      "links": [],
      "raw": "46752"
    },
    "EOSL date": {
      "text": "",
      "value": null,
      "datetime": null,
      "role": null,
      "links": [],
      "raw": ""
    },
    "End of Software Maintenance": {
      "text": "2027-12-31",
      "value": null,
      "datetime": null,
      "role": null,
      "links": [],
      "note": "the date firmware and applications stop receiving maintenance releases. This is a maintenance window, not a stated security-support end, so it is published and never mapped to eossec; the vendor's five-year support statement is not applied to it either."
    },
    "Run date": {
      "text": "December 16, 2025",
      "value": null,
      "datetime": null,
      "role": null,
      "links": [],
      "note": "the date the vendor stamped on the sheet this row was read from; it is the only version signal the extract carries."
    }
  },
  "provenance": {
    "source_urls": [
      "https://www.extremenetworks.com/support/end-of-sale-and-end-of-support-products/",
      "https://www.extremenetworks.com/support/end-of-sale-and-end-of-support-products/"
    ],
    "verifier": "deterministic-extreme",
    "last_checked": "2026-09-26T20:36:39Z"
  }
}
